{
  "schema_version": 1,
  "catalog_id": "gsm-author-presets",
  "version": "1.5.0",
  "updated_at": "2026-06-16T11:11:46.978Z",
  "base_url": ".",
  "packs": [
    {
      "id": "forza-fh6",
      "manifest_url": "packs/forza-fh6/manifest.json"
    },
    {
      "id": "subnautica2-overlay",
      "manifest_url": "packs/subnautica2-overlay/manifest.json"
    },
    {
      "id": "subnautica2-reshade",
      "manifest_url": "packs/subnautica2-reshade/manifest.json"
    },
    {
      "id": "unity-tiers",
      "manifest_url": "packs/unity-tiers/manifest.json"
    },
    {
      "id": "ue-catalog",
      "manifest_url": "packs/ue-catalog/manifest.json"
    }
  ]
}